{
  "apiNodes": [],
  "contractVersion": "us-runtime-stages-v2",
  "generatedFrom": [
    "microplex_us.pipelines.stage_contracts",
    "docs/us_pipeline_internals.map.json",
    "microplex_us.pipeline_metadata.pipeline_node"
  ],
  "graphSchemaVersion": 1,
  "pipeline": "us_microplex",
  "schemaVersion": 1,
  "stages": [
    {
      "id": "01_run_profile",
      "purpose": "Resolve the build profile, runtime config, providers, queries, and run-level options.",
      "step": "01",
      "substages": [
        {
          "description": "Resolve build configuration, provider query choices, output locations, and optional validation settings before any data is loaded.",
          "edges": [
            {
              "edgeType": "data_flow",
              "id": "config.build_config__config.provider_queries",
              "label": "resolves",
              "notes": [],
              "source": "config.build_config",
              "status": "current",
              "target": "config.provider_queries"
            },
            {
              "edgeType": "data_flow",
              "id": "config.build_config__us.pipeline.build_from_source_providers",
              "label": "starts build",
              "notes": [],
              "source": "config.build_config",
              "status": "current",
              "target": "us.pipeline.build_from_source_providers"
            },
            {
              "edgeType": "produces_artifact",
              "id": "us.pipeline.build_from_source_providers__artifact.run_profile",
              "label": "initializes",
              "notes": [],
              "source": "us.pipeline.build_from_source_providers",
              "status": "current",
              "target": "artifact.run_profile"
            }
          ],
          "id": "01a_resolve_run_profile",
          "nodes": [
            {
              "apiRefs": [],
              "artifactsIn": [],
              "artifactsOut": [],
              "description": "Stage 1 run metadata consumed by later stage manifests.",
              "details": "",
              "docstring": null,
              "id": "artifact.run_profile",
              "kind": null,
              "label": "Run profile manifest",
              "line": null,
              "nodeType": "artifact",
              "notes": [],
              "objectPath": null,
              "pydoc": null,
              "signature": null,
              "sourceFile": null,
              "status": "current"
            },
            {
              "apiRefs": [],
              "artifactsIn": [],
              "artifactsOut": [],
              "description": "User-facing configuration object for a US build.",
              "details": "",
              "docstring": null,
              "id": "config.build_config",
              "kind": null,
              "label": "USMicroplexBuildConfig",
              "line": null,
              "nodeType": "artifact",
              "notes": [],
              "objectPath": null,
              "pydoc": null,
              "signature": null,
              "sourceFile": null,
              "status": "current"
            },
            {
              "apiRefs": [],
              "artifactsIn": [],
              "artifactsOut": [],
              "description": "Resolved source-provider query settings.",
              "details": "",
              "docstring": null,
              "id": "config.provider_queries",
              "kind": null,
              "label": "Provider query plan",
              "line": null,
              "nodeType": "artifact",
              "notes": [],
              "objectPath": null,
              "pydoc": null,
              "signature": null,
              "sourceFile": null,
              "status": "current"
            },
            {
              "apiRefs": [],
              "artifactsIn": [],
              "artifactsOut": [
                "build_result"
              ],
              "description": "Canonical library entrypoint for a multi-provider US build.",
              "details": "",
              "docstring": "",
              "id": "us.pipeline.build_from_source_providers",
              "kind": "method",
              "label": "Build from source providers",
              "line": 2694,
              "nodeType": "entrypoint",
              "notes": [],
              "objectPath": "microplex_us.pipelines.us.USMicroplexPipeline.build_from_source_providers",
              "pydoc": "microplex_us.pipelines.us.USMicroplexPipeline.build_from_source_providers",
              "signature": "build_from_source_providers(self, providers, queries)",
              "sourceFile": "src/microplex_us/pipelines/us.py",
              "status": "current"
            }
          ],
          "stageId": "01_run_profile",
          "status": "current",
          "title": "Resolve run profile"
        }
      ],
      "title": "Run profile, config, and source bundle"
    },
    {
      "id": "02_source_loading",
      "purpose": "Load external datasets into validated Microplex observation frames.",
      "step": "02",
      "substages": [
        {
          "description": "Ask each configured provider for the requested source data and normalize it into source input records.",
          "edges": [
            {
              "edgeType": "external_source",
              "id": "external.source_providers__us.pipeline.prepare_source_input",
              "label": "queries",
              "notes": [],
              "source": "external.source_providers",
              "status": "current",
              "target": "us.pipeline.prepare_source_input"
            },
            {
              "edgeType": "produces_artifact",
              "id": "us.pipeline.prepare_source_input__artifact.source_frames",
              "label": "loads",
              "notes": [],
              "source": "us.pipeline.prepare_source_input",
              "status": "current",
              "target": "artifact.source_frames"
            }
          ],
          "id": "02a_prepare_source_input",
          "nodes": [
            {
              "apiRefs": [],
              "artifactsIn": [],
              "artifactsOut": [],
              "description": "Loaded source tables plus entity and relationship metadata.",
              "details": "",
              "docstring": null,
              "id": "artifact.source_frames",
              "kind": null,
              "label": "Observation frames",
              "line": null,
              "nodeType": "artifact",
              "notes": [],
              "objectPath": null,
              "pydoc": null,
              "signature": null,
              "sourceFile": null,
              "status": "current"
            },
            {
              "apiRefs": [],
              "artifactsIn": [],
              "artifactsOut": [],
              "description": "CPS, PUF, ACS, SIPP, and other provider implementations available to the run.",
              "details": "",
              "docstring": null,
              "id": "external.source_providers",
              "kind": null,
              "label": "Source providers",
              "line": null,
              "nodeType": "external",
              "notes": [],
              "objectPath": null,
              "pydoc": null,
              "signature": null,
              "sourceFile": null,
              "status": "current"
            },
            {
              "apiRefs": [],
              "artifactsIn": [],
              "artifactsOut": [
                "source_frames"
              ],
              "description": "Resolve provider queries into source frames used by the build.",
              "details": "",
              "docstring": "Validate and extract the source-planning context for a US build.",
              "id": "us.pipeline.prepare_source_input",
              "kind": "method",
              "label": "Prepare source input",
              "line": 3184,
              "nodeType": "process",
              "notes": [],
              "objectPath": "microplex_us.pipelines.us.USMicroplexPipeline.prepare_source_input",
              "pydoc": "microplex_us.pipelines.us.USMicroplexPipeline.prepare_source_input",
              "signature": "prepare_source_input(self, frame)",
              "sourceFile": "src/microplex_us/pipelines/us.py",
              "status": "current"
            }
          ],
          "stageId": "02_source_loading",
          "status": "current",
          "title": "Prepare source input"
        },
        {
          "description": "Carry source descriptors, entity observations, and household-person relationships with loaded tables.",
          "edges": [
            {
              "edgeType": "uses_library",
              "id": "artifact.source_frames__core.observation_frame",
              "label": "represented as",
              "notes": [],
              "source": "artifact.source_frames",
              "status": "current",
              "target": "core.observation_frame"
            },
            {
              "edgeType": "produces_artifact",
              "id": "core.observation_frame__artifact.source_semantics",
              "label": "describes",
              "notes": [],
              "source": "core.observation_frame",
              "status": "current",
              "target": "artifact.source_semantics"
            }
          ],
          "id": "02b_attach_source_semantics",
          "nodes": [
            {
              "apiRefs": [],
              "artifactsIn": [],
              "artifactsOut": [],
              "description": "Loaded source tables plus entity and relationship metadata.",
              "details": "",
              "docstring": null,
              "id": "artifact.source_frames",
              "kind": null,
              "label": "Observation frames",
              "line": null,
              "nodeType": "artifact",
              "notes": [],
              "objectPath": null,
              "pydoc": null,